<?xml version="1.0" encoding="utf-8"?>
<xs:schema xmlns="http://www.uniovi.es" elementFormDefault="qualified" targetNamespace="http://www.uniovi.es" xmlns:xs="http://www.w3.org/2001/XMLSchema">
	<xs:element name="circuito">
		<xs:complexType>
			<xs:sequence>
				<xs:element ref="nombre" />
				<xs:element ref="longitudcircuito" />
				<xs:element ref="anchura" />
				<xs:element ref="fecha" />
				<xs:element ref="hora" />
				<xs:element ref="vueltas" />
				<xs:element ref="localidad" />
				<xs:element ref="pais" />
				<xs:element ref="informacion" />
				<xs:element ref="multimedia" />
				<xs:element ref="salida" />
				<xs:element ref="tramos" />
			</xs:sequence>
		</xs:complexType>
	</xs:element>
	<xs:element name="nombre" type="xs:string" />
	<xs:element name="longitudcircuito">
		<xs:complexType>
			<xs:simpleContent>
				<xs:extension base="xs:decimal">
					<xs:attribute name="unidades" type="xs:string" use="required" />
				</xs:extension>
			</xs:simpleContent>
		</xs:complexType>
	</xs:element>
	<xs:element name="anchura">
		<xs:complexType>
			<xs:simpleContent>
				<xs:extension base="xs:integer">
					<xs:attribute name="unidades" type="xs:string" use="required" />
				</xs:extension>
			</xs:simpleContent>
		</xs:complexType>
	</xs:element>
	<xs:element name="fecha" type="xs:date" />
	<xs:element name="hora" type="xs:time" />
	<xs:element name="vueltas" type="xs:integer" />
	<xs:element name="localidad" type="xs:string" />
	<xs:element name="pais" type="xs:string" />
	<xs:element name="informacion">
		<xs:complexType>
			<xs:sequence>
				<xs:element minOccurs="3" maxOccurs="unbounded" ref="referencia" />
			</xs:sequence>
		</xs:complexType>
	</xs:element>
	<xs:element name="referencia" type="xs:string" />
	<xs:element name="multimedia">
		<xs:complexType>
			<xs:choice>
				<xs:element minOccurs="1" maxOccurs="5" ref="fotografia" />
				<xs:element minOccurs="0" maxOccurs="3" ref="video" />
			</xs:choice>
		</xs:complexType>
	</xs:element>
	<xs:element name="fotografia">
		<xs:complexType>
			<xs:sequence>
				<xs:element ref="url" />
				<xs:element minOccurs="0" maxOccurs="1" ref="pie" />
			</xs:sequence>
		</xs:complexType>
	</xs:element>
	<xs:element name="pie" type="xs:string" />
	<xs:element name="url" type="xs:string" />
	<xs:element name="video">
		<xs:complexType>
			<xs:sequence>
				<xs:element ref="url" />
				<xs:element minOccurs="0" maxOccurs="1" ref="pie" />
			</xs:sequence>
		</xs:complexType>
	</xs:element>
	<xs:element name="salida">
		<xs:complexType>
			<xs:sequence>
				<xs:element ref="coordenadas" />
			</xs:sequence>
		</xs:complexType>
	</xs:element>
	<xs:element name="coordenadas">
		<xs:complexType>
			<xs:sequence>
				<xs:element ref="longitud" />
				<xs:element ref="latitud" />
				<xs:element ref="altitud" />
			</xs:sequence>
		</xs:complexType>
	</xs:element>
	<xs:element name="longitud">
		<xs:complexType>
			<xs:sequence>
				<xs:element ref="gradosLongitud" />
			</xs:sequence>
		</xs:complexType>
	</xs:element>
	<xs:element name="latitud">
		<xs:complexType>
			<xs:sequence>
				<xs:element ref="gradosLatitud" />
			</xs:sequence>
		</xs:complexType>
	</xs:element>
	<xs:element name="altitud">
		<xs:simpleType>
			<xs:restriction base="xs:decimal">
				<xs:minInclusive value="0"/>
				<xs:maxInclusive value="8000"/>
			</xs:restriction>
		</xs:simpleType>
	</xs:element>
	<xs:element name="tramos">
		<xs:complexType>
			<xs:sequence>
				<xs:element minOccurs="1" maxOccurs="unbounded" ref="tramo" />
			</xs:sequence>
		</xs:complexType>
	</xs:element>
	<xs:element name="tramo">
		<xs:complexType>
			<xs:sequence>
				<xs:element ref="distancia" />
				<xs:element ref="coordenadas" />
				<xs:element ref="sector" />
			</xs:sequence>
		</xs:complexType>
	</xs:element>
	<xs:element name="distancia">
		<xs:complexType>
			<xs:simpleContent>
				<xs:extension base="xs:decimal">
					<xs:attribute name="unidades" type="xs:string" use="required" />
				</xs:extension>
			</xs:simpleContent>
		</xs:complexType>
	</xs:element>
	<xs:element name="sector" type="xs:integer" />
	<xs:element name="gradosLatitud">
		<xs:simpleType>
			<xs:restriction base="xs:decimal">
				<xs:minInclusive value="-90"/>
				<xs:maxInclusive value="90"/>
			</xs:restriction>
		</xs:simpleType>
	</xs:element>

	<xs:element name="gradosLongitud">
		<xs:simpleType>
			<xs:restriction base="xs:decimal">
				<xs:minInclusive value="0"/>
				<xs:maxInclusive value="180"/>
			</xs:restriction>
		</xs:simpleType>
	</xs:element>

	
</xs:schema>